{
  "name": "sap-btp-cloud-platform",
  "description": "Comprehensive SAP Business Technology Platform (BTP) reference for cloud development, deployment, and operations. Use when setting up BTP accounts (global accounts, directories, subaccounts), working with Cloud Foundry environment (orgs, spaces, buildpacks, service bindings), deploying to Kyma environment (Kubernetes, modules, serverless functions), developing in ABAP environment (RAP, CDS, ADT), managing entitlements and quotas, configuring identity providers (SAP Cloud Identity Services, XSUAA), implementing authentication and authorization (role collections, trust configuration), using btp CLI or CF CLI, deploying multi-target applications (MTA), setting up connectivity (destinations, Cloud Connector), implementing CI/CD pipelines (SAP Continuous Integration and Delivery), extending SAP solutions (S/4HANA Cloud, SuccessFactors), or troubleshooting BTP services. Covers all three runtime environments with production-tested patterns. Keywords: SAP BTP, SAP Business Technology Platform, Cloud Foundry, CF, Kyma, ABAP environment, subaccount, global account, directory, entitlements, quotas, btp CLI, CF CLI, MTA, multi-target application, XSUAA, SAP Authorization and Trust Management, Cloud Identity Services, Identity Authentication, destinations, Cloud Connector, service binding, buildpack, Kubernetes, serverless, RAP, CDS, CAP, SAP Cloud Application Programming Model, CI/CD, SAP Continuous Integration and Delivery, extensions, formations, trial account, free tier, enterprise account, consumption-based, subscription-based, CPEA, BTPEA, regions, availability zones, high availability, disaster recovery, audit logging, role collections, platform users, business users, Neo environment, service broker, space, org, namespace, Helm, Docker, Istio, API Gateway, Eventing",
  "version": "2.1.4",
  "author": {
    "name": "E.J.",
    "email": "maintainers@example.com"
  },
  "license": "GPL-3.0",
  "repository": "https://github.com/secondsky/sap-skills",
  "keywords": [
    "abap",
    "api",
    "authentication",
    "authorization",
    "btp",
    "cap",
    "cds",
    "cloud",
    "cloud foundry",
    "cloud platform",
    "deployment",
    "hana",
    "kyma",
    "platform",
    "production",
    "sap",
    "sap-btp-cloud-platform",
    "serverless"
  ],
  "category": "btp"
}
