{
  "name": "sap-btp-developer-guide",
  "description": "Develops business applications on SAP Business Technology Platform (BTP) using CAP (Node.js/Java) or ABAP Cloud.  Use when: building cloud applications on SAP BTP, deploying to Cloud Foundry or Kyma runtimes, integrating with SAP HANA Cloud, implementing SAP Fiori UIs, connecting to remote SAP systems, building multitenant SaaS applications, extending SAP S/4HANA or SuccessFactors, setting up CI/CD pipelines, implementing observability, or following SAP development best practices. Keywords: SAP BTP, Business Technology Platform, CAP, Cloud Application Programming Model, ABAP Cloud, Cloud Foundry, Kyma, SAP HANA Cloud, SAP Fiori, SAPUI5, CI/CD, observability, multitenant, SaaS, SAP BTP ABAP environment, SAP Business Application Studio, SAP Cloud SDK, SAP Integration Suite, SAP Event Mesh, SAP Connectivity Service, SAP Destination Service, XSUAA, OAuth, OpenID Connect, OData, CDS, Core Data Services, ABAP CDS, ABAP RESTful Application Programming Model, RAP, ABAP development, SAP BTP development",
  "version": "2.1.4",
  "author": {
    "name": "E.J.",
    "email": "maintainers@example.com"
  },
  "license": "GPL-3.0",
  "repository": "https://github.com/secondsky/sap-skills",
  "keywords": [
    "abap",
    "btp",
    "cap",
    "cds",
    "cloud foundry",
    "cloud platform",
    "developer",
    "fiori",
    "guide",
    "hana",
    "java",
    "kyma",
    "node.js",
    "oauth",
    "odata",
    "rest",
    "sap",
    "sap-btp-developer-guide"
  ],
  "category": "btp"
}
