{
  "name": "sap-datasphere",
  "description": "Comprehensive plugin for SAP Datasphere development with 3 specialized agents, 5 slash commands, and validation hooks. Use when building data warehouses on SAP BTP, creating analytic models, configuring data flows and replication flows, setting up connections to SAP and third-party systems, managing spaces and users, implementing data access controls, using the datasphere CLI, creating data products for the marketplace, or monitoring data integration tasks. Covers Data Builder (graphical/SQL views, local/remote tables, transformation flows), Business Builder (business entities, consumption models), analytic models (dimensions, measures, hierarchies), 40+ connection types (SAP S/4HANA, BW/4HANA, HANA Cloud, AWS, Azure, GCP, Kafka, Generic HTTP), real-time replication, task chains, content transport, CLI automation, catalog governance, and data marketplace. Includes 2025 features: Generic HTTP connections, REST API tasks in task chains, SAP Business Data Cloud integration. Keywords: sap datasphere, data warehouse cloud, dwc, data builder, business builder, analytic model, graphical view, sql view, transformation flow, replication flow, data flow, task chain, remote table, local table, sap btp data warehouse, datasphere connection, datasphere space, data access control, elastic compute node, sap analytics cloud integration, datasphere cli, data products, data marketplace, catalog, governance",
  "version": "2.1.4",
  "author": {
    "name": "E.J.",
    "email": "maintainers@example.com"
  },
  "license": "GPL-3.0",
  "repository": "https://github.com/secondsky/sap-skills",
  "keywords": [
    "analytics",
    "api",
    "btp",
    "dashboard",
    "data",
    "datasphere",
    "hana",
    "http",
    "rest",
    "sac",
    "sap",
    "sap-datasphere",
    "sql",
    "visualization"
  ],
  "category": "data-analytics",
  "agents": [
    "./agents/datasphere-integration-advisor.md",
    "./agents/datasphere-admin-helper.md",
    "./agents/datasphere-modeler.md"
  ],
  "commands": [
    "./commands/datasphere-cli.md",
    "./commands/datasphere-connection-guide.md",
    "./commands/datasphere-space-template.md",
    "./commands/datasphere-view-template.md",
    "./commands/datasphere-mcp-tools.md"
  ]
}
